{
  "$schema": "https://json-schema.org/draft/2020-12/schema",
  "$id": "https://village-swarm.local/contracts/v1/config.schema.json",
  "title": "vs/v1/dev/{id}/config (retained, hive -> hornet). Sections a role does not use are omitted",
  "type": "object",
  "required": [
    "v",
    "rev",
    "name",
    "health_interval_s"
  ],
  "properties": {
    "v": {
      "const": 1
    },
    "rev": {
      "type": "integer",
      "minimum": 0
    },
    "name": {
      "type": "string",
      "minLength": 1,
      "description": "Human name, may be Cyrillic"
    },
    "health_interval_s": {
      "type": "integer",
      "minimum": 10
    },
    "tele_interval_s": {
      "type": "integer",
      "minimum": 1
    },
    "sleep_s": {
      "type": "integer",
      "description": "Battery hornets: deep sleep this long between readings (wake, send, sleep). 0 or absent: always awake. While asleep the hornet keeps its last status; the hive treats it as lost after several missed wake-ups",
      "anyOf": [
        {
          "const": 0
        },
        {
          "minimum": 60,
          "maximum": 86400
        }
      ]
    },
    "sleep_mode": {
      "enum": [
        "deep",
        "light"
      ],
      "description": "How a hornet with sleep_s > 0 saves power. deep (default): radio and CPU off between readings, disconnects; needs GPIO16 wired to RST on ESP8266. light: stays connected with Wi-Fi power saving and reads every sleep_s; works on any board, saves far less"
    },
    "features": {
      "type": "array",
      "uniqueItems": true,
      "items": {
        "enum": [
          "thermometer",
          "bme280",
          "relay",
          "heater"
        ]
      },
      "description": "What the hornet is used for (roles meteo, relay, heat). thermometer: a temperature sensor, DS18B20s on 1-Wire or a DHT11/DHT22 (hw.thermometer); bme280: BME280 on I2C; relay: a relay switched by commands; heater: that relay heats and the hornet itself keeps failsafe.heater (needs relay and a sensor). Pins of features not listed are left alone. Absent: the role's default (meteo: thermometer, bme280; relay: relay; heat: thermometer, relay, heater)"
    },
    "failsafe": {
      "type": "object",
      "properties": {
        "heater": {
          "type": "object",
          "required": [
            "min_c",
            "max_c",
            "max_on_s"
          ],
          "properties": {
            "min_c": {
              "type": "number"
            },
            "max_c": {
              "type": "number"
            },
            "max_on_s": {
              "type": "integer",
              "minimum": 1
            },
            "sensor": {
              "type": "string",
              "minLength": 1
            }
          },
          "additionalProperties": false
        }
      },
      "additionalProperties": false
    },
    "guard": {
      "type": "object",
      "properties": {
        "armed": {
          "type": "boolean"
        },
        "cooldown_s": {
          "type": "integer",
          "minimum": 0
        },
        "record_when_disarmed": {
          "type": "boolean"
        },
        "check_photo_every_min": {
          "type": "integer",
          "minimum": 0
        }
      },
      "additionalProperties": false
    },
    "camera": {
      "type": "object",
      "properties": {
        "frame": {
          "enum": [
            "QVGA",
            "VGA",
            "SVGA",
            "XGA",
            "HD",
            "SXGA",
            "UXGA"
          ]
        },
        "quality": {
          "type": "integer",
          "minimum": 4,
          "maximum": 63
        },
        "burst": {
          "type": "integer",
          "minimum": 1,
          "maximum": 10
        },
        "burst_interval_ms": {
          "type": "integer",
          "minimum": 0
        },
        "ir_led": {
          "enum": [
            "auto",
            "on",
            "off"
          ]
        }
      },
      "additionalProperties": false
    },
    "upload": {
      "type": "object",
      "required": [
        "primary"
      ],
      "properties": {
        "primary": {
          "type": "string",
          "format": "uri"
        },
        "fallback": {
          "type": "string",
          "format": "uri"
        }
      },
      "additionalProperties": false
    },
    "hw": {
      "description": "Board wiring; omitted fields keep the firmware defaults for the board",
      "type": "object",
      "properties": {
        "onewire_pin": {
          "type": "integer",
          "minimum": 0,
          "maximum": 48
        },
        "dht_pin": {
          "type": "integer",
          "minimum": 0,
          "maximum": 48,
          "description": "DHT11/DHT22 data pin, used when thermometer is dht11 or dht22"
        },
        "sda_pin": {
          "type": "integer",
          "minimum": 0,
          "maximum": 48
        },
        "scl_pin": {
          "type": "integer",
          "minimum": 0,
          "maximum": 48
        },
        "relay_pin": {
          "type": "integer",
          "minimum": 0,
          "maximum": 48
        },
        "ir_pin": {
          "type": "integer",
          "minimum": 0,
          "maximum": 48,
          "description": "Roles irrx and irtx: the pin of the infrared receiver or emitter (GPIO2 on the ESP-01 with the WS2812 connector)"
        },
        "relay_active_low": {
          "type": "boolean"
        },
        "button_pin": {
          "type": "integer",
          "minimum": 0,
          "maximum": 48
        },
        "led_pin": {
          "type": "integer",
          "minimum": 0,
          "maximum": 48
        },
        "vbat_pin": {
          "type": "integer",
          "minimum": 0,
          "maximum": 48,
          "description": "ADC pin with a voltage divider from the battery (roles meteo and relay; ESP8266 always reads A0 = 17)"
        },
        "vbat_ratio": {
          "type": "number",
          "exclusiveMinimum": 0,
          "description": "Divider ratio (R1+R2)/R2, e.g. 5.7 for 47k/10k: battery V = pin V x ratio"
        },
        "thermometer": {
          "enum": [
            "ds18b20",
            "dht11",
            "dht22"
          ],
          "description": "Which sensor the feature thermometer reads (roles meteo and heat). ds18b20: one or more on 1-Wire (onewire_pin); dht11 or dht22: one DHT on dht_pin, which also gives humidity. Absent: the board's (dht11 on the esp-01-dht11 module, ds18b20 elsewhere)"
        }
      },
      "additionalProperties": false
    },
    "relay": {
      "type": "object",
      "properties": {
        "channel": {
          "$ref": "common.schema.json#/$defs/segment"
        },
        "max_on_s": {
          "type": "integer",
          "minimum": 0,
          "description": "0 = no limit; the relay switches off by itself after this"
        }
      },
      "additionalProperties": false
    },
    "display": {
      "type": "object",
      "description": "Screen of a hornet or a monitor: what the hive feeds it (items, vs/v1/hive/display/{id}); lines: up to two of its own metrics on the old meteo-c3oled build",
      "properties": {
        "lines": {
          "type": "array",
          "maxItems": 2,
          "items": {
            "$ref": "common.schema.json#/$defs/segment"
          }
        },
        "rotation": {
          "enum": [0, 90, 180, 270],
          "description": "Screens the hive draws (e-ink): how the picture is turned, clockwise. Items, x, y and the background image are laid out in the turned screen (a panel standing on its side is 90 or 270); the hive turns the finished picture back for the panel. Absent: 0"
        },
        "items": {
          "type": "array",
          "maxItems": 8,
          "description": "What the screen shows, kept by the hive: a reading of this hornet or of another device. Up to 4 in the automatic layout, up to 8 when placed (size set). The hornet does not read it: the hive turns it into the display message",
          "items": {
            "type": "object",
            "anyOf": [{ "required": ["metric"] }, { "required": ["text"] }],
            "properties": {
              "device": { "$ref": "common.schema.json#/$defs/deviceId", "description": "Absent: this hornet" },
              "metric": { "$ref": "common.schema.json#/$defs/segment" },
              "text": { "type": "string", "minLength": 1, "maxLength": 24, "description": "A caption the person typed instead of a reading: shown as it is, without a source (then device and metric are absent)" },
              "label": { "type": "string", "maxLength": 16 },
              "x": { "type": "integer", "minimum": 0, "maximum": 1023, "description": "Placed layout: pixels from the left edge to the anchor of the text (align says which edge of the text). Absent: 0" },
              "y": { "type": "integer", "minimum": 0, "maximum": 1023, "description": "Placed layout: pixels from the top edge to the top of the text (of the label when there is one). Absent: 0" },
              "size": { "type": "integer", "minimum": 1, "maximum": 10, "description": "Relative text height: size/10 of the screen height, at least 6 px; the screen takes its largest font not taller than that. Set on any item: the whole screen is placed by x, y, size" },
              "align": { "enum": ["left", "center", "right"], "description": "Placed layout: which edge of the text x is. Absent: left" },
              "font": { "type": "string", "pattern": "^[a-z0-9]+(-[a-z0-9]+)*$", "maxLength": 40, "description": "Screens the hive draws (e-ink): the id of the font family (GET /api/display/fonts). Absent: the standard font. The panel only shows the picture; the small OLED ignores it" },
              "px": { "type": "integer", "minimum": 6, "maximum": 48, "description": "Screens the hive draws: the size of the font in pixels. Absent: derived from size. Ignored by the small OLED" },
              "bold": { "type": "boolean", "description": "Screens the hive draws: bold (a family without a bold face is emboldened)" },
              "italic": { "type": "boolean", "description": "Screens the hive draws: italic (a family without an italic face is slanted)" }
            },
            "additionalProperties": false
          }
        }
      },
      "additionalProperties": false
    },
    "ir": {
      "description": "Roles irrx and irtx: the remote's buttons learned and named by the family. The hive keeps them and sends the code with each cmd/ir; the hornet does not read them",
      "type": "object",
      "properties": {
        "buttons": {
          "type": "object",
          "maxProperties": 40,
          "additionalProperties": {
            "type": "object",
            "required": ["protocol", "bits", "data"],
            "properties": {
              "protocol": { "type": "string", "pattern": "^[A-Za-z0-9_]{2,24}$" },
              "bits": { "type": "integer", "minimum": 1, "maximum": 64 },
              "data": { "type": "string", "pattern": "^0[xX][0-9A-Fa-f]{1,16}$" }
            },
            "additionalProperties": false
          }
        }
      },
      "additionalProperties": false
    },
    "ble": {
      "description": "Role ble: the Bluetooth LE thermometer the hornet is a bridge for (Inkbird IHT-2PB)",
      "type": "object",
      "properties": {
        "mac": {
          "type": "string",
          "pattern": "^([0-9A-Fa-f]{2}:){5}[0-9A-Fa-f]{2}$",
          "description": "Bluetooth address of the thermometer; without it the hornet scans and lists what it hears in its log"
        },
        "dump": {
          "type": "boolean",
          "description": "Put the raw notification frames in the hornet's log (to check the decoding against the thermometer's own app)"
        }
      },
      "additionalProperties": false
    }
  },
  "additionalProperties": false
}
